{
    "@odata.context": "/redfish/v1/$metadata#EthernetInterface.EthernetInterface",
    "@odata.etag": "W/\"16846800\"",
    "@odata.id": "/redfish/v1/Systems/1/EthernetInterfaces/3",
    "@odata.type": "#EthernetInterface.v1_4_1.EthernetInterface",
    "Id": "3",
    "FullDuplex": false,
    "IPv4Addresses": [],
    "IPv4StaticAddresses": [],
    "IPv6AddressPolicyTable": [],
    "IPv6Addresses": [
        {
            "Address": "N/A"
        }
    ],
    "IPv6StaticAddresses": [],
    "IPv6StaticDefaultGateways": [],
    "InterfaceEnabled": false,
    "LinkStatus": null,
    "MACAddress": "68:05:ca:e1:36:7e",
    "Name": "vmnic2",
    "NameServers": [],
    "SpeedMbps": null,
    "StaticNameServers": [],
    "Status": {
        "Health": null,
        "State": null
    }
}